construct,domain,component,source_concept_ids,standardized_variable,score_direction,standardization_rule,required_for_primary_crvi,codebook_status,notes
CRVI,low_respiratory_reserve,PEF standardized residual,CHARLS_RESP_001;CHARLS_RESP_003;CHARLS_DEMO_001;CHARLS_DEMO_002,pef_std_resid,lower_is_more_vulnerable,Regress or percentile-standardize PEF within age sex height strata after codebook verification,yes,TODO_CODEBOOK_CHECK,Do not compute until PEF units and height units are verified.
CRVI,frailty_deficit,Frailty Index or modified Fried phenotype,CHARLS_FRAIL_001;CHARLS_FRAIL_002;CHARLS_FRAIL_003;CHARLS_FRAIL_004;CHARLS_FRAIL_005;CHARLS_FRAIL_006,frailty_score,higher_is_more_vulnerable,Use FI if enough deficits are mapped; otherwise modified Fried phenotype with documented components,yes,TODO_CODEBOOK_CHECK,Define robust pre-frail frail thresholds before modeling.
CRVI,inflammation_metabolic,Inflammation-metabolic imbalance,CHARLS_RESP_005;CHARLS_BIO_002;CHARLS_BIO_003;CHARLS_BIO_004;CHARLS_BIO_005,inflammation_metabolic_score,higher_is_more_vulnerable,Within-wave z score or percentile composite after biomarker units are verified,conditional,TODO_CODEBOOK_CHECK,Use as optional domain if biomarker coverage is insufficient.
CRVI,social_behavioral,Smoking and socioeconomic context,CHARLS_SMOKE_001;CHARLS_SMOKE_002;CHARLS_SMOKE_003;CHARLS_SOC_001;CHARLS_SOC_002;CHARLS_SOC_003,social_behavioral_context,mixed,Use as covariates subgroup or sensitivity factors rather than mandatory CRVI biology domain,no,TODO_CODEBOOK_CHECK,Do not interpret as a biological CRVI component.
CRVI,outcome,chronic lung disease incidence,CHARLS_RESP_006,incident_chronic_lung_disease,yes_is_event,Exclude prevalent disease for incident analyses after baseline status is verified,primary_outcome,TODO_CODEBOOK_CHECK,Not equivalent to spirometric COPD unless objective spirometry exists.
CRVI,outcome,frailty progression,CHARLS_FRAIL_006;CHARLS_ADL_001;CHARLS_ADL_002,frailty_progression,yes_is_event,Define robust/pre-frail/frail transition using mapped FI or Fried-like phenotype,primary_outcome,TODO_CODEBOOK_CHECK,Death should be handled as absorbing or competing state.
CRVI,outcome,functional decline,CHARLS_ADL_001;CHARLS_ADL_002,functional_decline,yes_is_event,Define incident or worsening ADL/IADL limitation after item mapping,secondary_outcome,TODO_CODEBOOK_CHECK,Use when CLD event count is insufficient.
CRVI,outcome,mortality,CHARLS_DEATH_001;CHARLS_DEATH_002,death,yes_is_event,Use verified death status and timing source,secondary_or_absorbing,TODO_CODEBOOK_CHECK,Do not infer death from missing follow-up alone.
